[
 {
  "cardId": "chase-freedom-flex",
  "name": "Chase Freedom Flex",
  "issuer": "chase",
  "cardKind": "personal",
  "hasWelcomeOffer": true,
  "sourceText": "Earn a $250 bonus after you spend $500 on purchases in the first 3 months from account opening",
  "seenOn": "2026-10-25",
  "parsed": {
   "kind": "standard",
   "points": 25000.0,
   "cashBack": null,
   "freeNightAwards": 0,
   "minSpend": 500.0,
   "windowMonths": 3,
   "additionalTiers": [],
   "ceiling": false,
   "notes": [
    "advertised as $250 cash back but paid as ultimate-rewards points"
   ],
   "displayedAsCash": 250.0,
   "currency": "ultimate-rewards"
  },
  "needsReview": false
 },
 {
  "cardId": "chase-freedom-rise",
  "name": "Chase Freedom Rise",
  "issuer": "chase",
  "cardKind": "personal",
  "hasWelcomeOffer": false,
  "needsReview": false
 },
 {
  "cardId": "chase-freedom-unlimited",
  "name": "Chase Freedom Unlimited",
  "issuer": "chase",
  "cardKind": "personal",
  "hasWelcomeOffer": true,
  "sourceText": "Earn a $200 bonus after you spend $500 on purchases in the first 3 months from account opening",
  "seenOn": "2026-10-25",
  "parsed": {
   "kind": "standard",
   "points": 20000.0,
   "cashBack": null,
   "freeNightAwards": 0,
   "minSpend": 500.0,
   "windowMonths": 3,
   "additionalTiers": [],
   "ceiling": false,
   "notes": [
    "advertised as $200 cash back but paid as ultimate-rewards points"
   ],
   "displayedAsCash": 200.0,
   "currency": "ultimate-rewards"
  },
  "needsReview": false
 },
 {
  "cardId": "chase-sapphire-preferred",
  "name": "Chase Sapphire Preferred",
  "issuer": "chase",
  "cardKind": "personal",
  "hasWelcomeOffer": true,
  "sourceText": "Earn 75,000 points after you spend $5,000 in purchases in the first 3 months from account opening",
  "seenOn": "2026-10-25",
  "parsed": {
   "kind": "standard",
   "points": 75000.0,
   "cashBack": null,
   "freeNightAwards": 0,
   "minSpend": 5000.0,
   "windowMonths": 3,
   "additionalTiers": [],
   "ceiling": false,
   "notes": [],
   "displayedAsCash": null
  },
  "needsReview": false
 },
 {
  "cardId": "chase-sapphire-reserve",
  "name": "Chase Sapphire Reserve",
  "issuer": "chase",
  "cardKind": "personal",
  "hasWelcomeOffer": true,
  "sourceText": "Earn 100,000 points after you spend $6,000 in purchases in the first 3 months from account opening",
  "seenOn": "2026-10-25",
  "parsed": {
   "kind": "standard",
   "points": 100000.0,
   "cashBack": null,
   "freeNightAwards": 0,
   "minSpend": 6000.0,
   "windowMonths": 3,
   "additionalTiers": [],
   "ceiling": false,
   "notes": [
    "an authorized-user or employee-card bonus is excluded"
   ],
   "displayedAsCash": null
  },
  "needsReview": false
 },
 {
  "cardId": "chase-united-explorer",
  "name": "United Explorer Card",
  "issuer": "chase",
  "cardKind": "personal",
  "hasWelcomeOffer": true,
  "sourceText": "Earn 70,000 bonus miles after you spend $3,000 on purchases in the first 3 months your account is open",
  "seenOn": "2026-10-25",
  "parsed": {
   "kind": "standard",
   "points": 70000.0,
   "cashBack": null,
   "freeNightAwards": 0,
   "minSpend": 3000.0,
   "windowMonths": 3,
   "additionalTiers": [],
   "ceiling": false,
   "notes": [
    "an authorized-user or employee-card bonus is excluded"
   ],
   "displayedAsCash": null
  },
  "needsReview": false
 },
 {
  "cardId": "chase-united-gateway",
  "name": "United Gateway Card",
  "issuer": "chase",
  "cardKind": "personal",
  "hasWelcomeOffer": true,
  "sourceText": "Earn 40,000 bonus miles after you spend $1,000 on purchases in the first 3 months your account is open",
  "seenOn": "2026-10-25",
  "parsed": {
   "kind": "standard",
   "points": 40000.0,
   "cashBack": null,
   "freeNightAwards": 0,
   "minSpend": 1000.0,
   "windowMonths": 3,
   "additionalTiers": [],
   "ceiling": false,
   "notes": [
    "an authorized-user or employee-card bonus is excluded"
   ],
   "displayedAsCash": null
  },
  "needsReview": false
 },
 {
  "cardId": "chase-united-quest",
  "name": "United Quest Card",
  "issuer": "chase",
  "cardKind": "personal",
  "hasWelcomeOffer": true,
  "sourceText": "Earn 500 PQP after first purchase and 80,000 bonus miles after you spend $4,000 on purchases in the first 3 months your account is open",
  "seenOn": "2026-10-25",
  "parsed": {
   "kind": "standard",
   "points": 80000.0,
   "cashBack": null,
   "freeNightAwards": 0,
   "minSpend": 4000.0,
   "windowMonths": 3,
   "additionalTiers": [],
   "ceiling": false,
   "notes": [],
   "displayedAsCash": null
  },
  "needsReview": false
 },
 {
  "cardId": "chase-united-club-infinite",
  "name": "United Club Infinite Card",
  "issuer": "chase",
  "cardKind": "personal",
  "hasWelcomeOffer": true,
  "sourceText": "Earn 90,000 bonus miles after you spend $5,000 on purchases in the first 3 months your account is open",
  "seenOn": "2026-10-25",
  "parsed": {
   "kind": "standard",
   "points": 90000.0,
   "cashBack": null,
   "freeNightAwards": 0,
   "minSpend": 5000.0,
   "windowMonths": 3,
   "additionalTiers": [],
   "ceiling": false,
   "notes": [
    "an authorized-user or employee-card bonus is excluded"
   ],
   "displayedAsCash": null
  },
  "needsReview": false
 },
 {
  "cardId": "chase-marriott-bold",
  "name": "Marriott Bonvoy Bold Credit Card",
  "issuer": "chase",
  "cardKind": "personal",
  "hasWelcomeOffer": true,
  "sourceText": "Earn 45,000 Bonus Points after spending $1,000 on eligible purchases within 3 months of account opening with the Marriott Bonvoy Bold \u00ae Credit Card",
  "seenOn": "2026-10-25",
  "parsed": {
   "kind": "standard",
   "points": 45000.0,
   "cashBack": null,
   "freeNightAwards": 0,
   "minSpend": 1000.0,
   "windowMonths": 3,
   "additionalTiers": [],
   "ceiling": false,
   "notes": [],
   "displayedAsCash": null
  },
  "needsReview": false
 },
 {
  "cardId": "chase-marriott-bountiful",
  "name": "Marriott Bonvoy Bountiful Credit Card",
  "issuer": "chase",
  "cardKind": "personal",
  "hasWelcomeOffer": true,
  "sourceText": "Earn 85,000 Bonus Points after you spend $4,000 in purchases in your first 3 months from your account opening",
  "seenOn": "2026-10-25",
  "parsed": {
   "kind": "standard",
   "points": 85000.0,
   "cashBack": null,
   "freeNightAwards": 0,
   "minSpend": 4000.0,
   "windowMonths": 3,
   "additionalTiers": [],
   "ceiling": false,
   "notes": [],
   "displayedAsCash": null
  },
  "needsReview": false
 },
 {
  "cardId": "chase-marriott-boundless",
  "name": "Marriott Bonvoy Boundless Credit Card",
  "issuer": "chase",
  "cardKind": "personal",
  "hasWelcomeOffer": true,
  "sourceText": "Earn 3 Free Night Awards after spending $3,000 on eligible purchases within 3 months of account opening with the Marriott Bonvoy Boundless \u00ae Credit Card",
  "seenOn": "2026-10-25",
  "parsed": {
   "kind": "standard",
   "points": null,
   "cashBack": null,
   "freeNightAwards": 3,
   "minSpend": 3000.0,
   "windowMonths": 3,
   "additionalTiers": [],
   "ceiling": false,
   "notes": [],
   "displayedAsCash": null
  },
  "needsReview": false
 },
 {
  "cardId": "chase-ihg-premier",
  "name": "IHG One Rewards Premier Credit Card",
  "issuer": "chase",
  "cardKind": "personal",
  "hasWelcomeOffer": true,
  "sourceText": "Earn 180,000 Bonus Points after you spend $3,000 on purchases in the first 3 months from account opening",
  "seenOn": "2026-10-25",
  "parsed": {
   "kind": "standard",
   "points": 180000.0,
   "cashBack": null,
   "freeNightAwards": 0,
   "minSpend": 3000.0,
   "windowMonths": 3,
   "additionalTiers": [],
   "ceiling": false,
   "notes": [],
   "displayedAsCash": null
  },
  "needsReview": false
 },
 {
  "cardId": "chase-ihg-premier-select",
  "name": "IHG One Rewards Premier Select Credit Card",
  "issuer": "chase",
  "cardKind": "personal",
  "hasWelcomeOffer": true,
  "sourceText": "Earn 200,000 Bonus Points after you spend $5,000 on purchases in the first 3 months from account opening",
  "seenOn": "2026-10-25",
  "parsed": {
   "kind": "standard",
   "points": 200000.0,
   "cashBack": null,
   "freeNightAwards": 0,
   "minSpend": 5000.0,
   "windowMonths": 3,
   "additionalTiers": [],
   "ceiling": false,
   "notes": [],
   "displayedAsCash": null
  },
  "needsReview": false
 },
 {
  "cardId": "chase-ihg-traveler",
  "name": "IHG One Rewards Credit Card",
  "issuer": "chase",
  "cardKind": "personal",
  "hasWelcomeOffer": true,
  "sourceText": "Earn 125,000 Bonus Points after you spend $2,000 on purchases in the first 3 months from account opening",
  "seenOn": "2026-10-25",
  "parsed": {
   "kind": "standard",
   "points": 125000.0,
   "cashBack": null,
   "freeNightAwards": 0,
   "minSpend": 2000.0,
   "windowMonths": 3,
   "additionalTiers": [],
   "ceiling": false,
   "notes": [],
   "displayedAsCash": null
  },
  "needsReview": false
 },
 {
  "cardId": "chase-world-of-hyatt",
  "name": "World of Hyatt Credit Card",
  "issuer": "chase",
  "cardKind": "personal",
  "hasWelcomeOffer": true,
  "sourceText": "Earn up to 60,000 Bonus Points 30,000 Bonus Points after you spend $3,000 on purchases in your first 3 months of account opening",
  "seenOn": "2026-10-25",
  "parsed": {
   "kind": "standard",
   "points": 30000.0,
   "cashBack": null,
   "freeNightAwards": 0,
   "minSpend": 3000.0,
   "windowMonths": 3,
   "additionalTiers": [],
   "ceiling": false,
   "notes": [
    "counted the first part only (the rest depends on further bonus spending)"
   ],
   "displayedAsCash": null
  },
  "reviewedByOwner": true,
  "needsReview": false
 },
 {
  "cardId": "chase-southwest-plus",
  "name": "Southwest Rapid Rewards Plus Credit Card",
  "issuer": "chase",
  "cardKind": "personal",
  "hasWelcomeOffer": true,
  "sourceText": "Earn 50,000 bonus points after you spend $1,000 on purchases in the first 3 months from account opening",
  "seenOn": "2026-10-25",
  "parsed": {
   "kind": "standard",
   "points": 50000.0,
   "cashBack": null,
   "freeNightAwards": 0,
   "minSpend": 1000.0,